{
  "$schema": "https://json-schema.org/draft/2020-12/schema",
  "title": "Operator evaluation receipt (not a TRINITY artifact)",
  "type": "object",
  "properties": {
    "receipt_version": {
      "const": "1"
    },
    "evaluation_id": {
      "type": "string",
      "minLength": 1
    },
    "test_id": {
      "type": "string",
      "minLength": 1
    },
    "phase": {
      "enum": [
        "PRE_EXECUTION",
        "FINAL"
      ]
    },
    "recorded_at": {
      "type": "string",
      "minLength": 1
    },
    "expected_timing": {
      "enum": [
        "BEFORE_EXECUTION",
        "AFTER_EXECUTION",
        "UNRESOLVED"
      ]
    },
    "functional_result": {
      "type": "string",
      "minLength": 1
    },
    "evidence": {
      "type": "object",
      "properties": {
        "fixture_identity": {
          "anyOf": [
            {
              "type": "object",
              "properties": {
                "status": {
                  "const": "PRESENT"
                },
                "path": {
                  "type": "string",
                  "minLength": 1
                },
                "sha256": {
                  "type": "string",
                  "pattern": "^[0-9a-f]{64}$"
                }
              },
              "required": [
                "status",
                "path",
                "sha256"
              ],
              "additionalProperties": false
            },
            {
              "type": "object",
              "properties": {
                "status": {
                  "enum": [
                    "MISSING",
                    "PARTIAL",
                    "UNRESOLVED"
                  ]
                },
                "reason": {
                  "type": "string",
                  "minLength": 1
                }
              },
              "required": [
                "status",
                "reason"
              ],
              "additionalProperties": false
            }
          ]
        },
        "expected_oracle": {
          "anyOf": [
            {
              "type": "object",
              "properties": {
                "status": {
                  "const": "PRESENT"
                },
                "path": {
                  "type": "string",
                  "minLength": 1
                },
                "sha256": {
                  "type": "string",
                  "pattern": "^[0-9a-f]{64}$"
                }
              },
              "required": [
                "status",
                "path",
                "sha256"
              ],
              "additionalProperties": false
            },
            {
              "type": "object",
              "properties": {
                "status": {
                  "enum": [
                    "MISSING",
                    "PARTIAL",
                    "UNRESOLVED"
                  ]
                },
                "reason": {
                  "type": "string",
                  "minLength": 1
                }
              },
              "required": [
                "status",
                "reason"
              ],
              "additionalProperties": false
            }
          ]
        },
        "human_authority": {
          "anyOf": [
            {
              "type": "object",
              "properties": {
                "status": {
                  "const": "PRESENT"
                },
                "path": {
                  "type": "string",
                  "minLength": 1
                },
                "sha256": {
                  "type": "string",
                  "pattern": "^[0-9a-f]{64}$"
                }
              },
              "required": [
                "status",
                "path",
                "sha256"
              ],
              "additionalProperties": false
            },
            {
              "type": "object",
              "properties": {
                "status": {
                  "enum": [
                    "MISSING",
                    "PARTIAL",
                    "UNRESOLVED"
                  ]
                },
                "reason": {
                  "type": "string",
                  "minLength": 1
                }
              },
              "required": [
                "status",
                "reason"
              ],
              "additionalProperties": false
            }
          ]
        },
        "pre_execution_receipt": {
          "anyOf": [
            {
              "type": "object",
              "properties": {
                "status": {
                  "const": "PRESENT"
                },
                "path": {
                  "type": "string",
                  "minLength": 1
                },
                "sha256": {
                  "type": "string",
                  "pattern": "^[0-9a-f]{64}$"
                }
              },
              "required": [
                "status",
                "path",
                "sha256"
              ],
              "additionalProperties": false
            },
            {
              "type": "object",
              "properties": {
                "status": {
                  "enum": [
                    "MISSING",
                    "PARTIAL",
                    "UNRESOLVED"
                  ]
                },
                "reason": {
                  "type": "string",
                  "minLength": 1
                }
              },
              "required": [
                "status",
                "reason"
              ],
              "additionalProperties": false
            }
          ]
        },
        "repository_snapshot": {
          "anyOf": [
            {
              "type": "object",
              "properties": {
                "status": {
                  "const": "PRESENT"
                },
                "path": {
                  "type": "string",
                  "minLength": 1
                },
                "sha256": {
                  "type": "string",
                  "pattern": "^[0-9a-f]{64}$"
                }
              },
              "required": [
                "status",
                "path",
                "sha256"
              ],
              "additionalProperties": false
            },
            {
              "type": "object",
              "properties": {
                "status": {
                  "enum": [
                    "MISSING",
                    "PARTIAL",
                    "UNRESOLVED"
                  ]
                },
                "reason": {
                  "type": "string",
                  "minLength": 1
                }
              },
              "required": [
                "status",
                "reason"
              ],
              "additionalProperties": false
            }
          ]
        },
        "executor_model": {
          "anyOf": [
            {
              "type": "object",
              "properties": {
                "status": {
                  "const": "PRESENT"
                },
                "path": {
                  "type": "string",
                  "minLength": 1
                },
                "sha256": {
                  "type": "string",
                  "pattern": "^[0-9a-f]{64}$"
                }
              },
              "required": [
                "status",
                "path",
                "sha256"
              ],
              "additionalProperties": false
            },
            {
              "type": "object",
              "properties": {
                "status": {
                  "enum": [
                    "MISSING",
                    "PARTIAL",
                    "UNRESOLVED"
                  ]
                },
                "reason": {
                  "type": "string",
                  "minLength": 1
                }
              },
              "required": [
                "status",
                "reason"
              ],
              "additionalProperties": false
            }
          ]
        },
        "runtime_configuration": {
          "anyOf": [
            {
              "type": "object",
              "properties": {
                "status": {
                  "const": "PRESENT"
                },
                "path": {
                  "type": "string",
                  "minLength": 1
                },
                "sha256": {
                  "type": "string",
                  "pattern": "^[0-9a-f]{64}$"
                }
              },
              "required": [
                "status",
                "path",
                "sha256"
              ],
              "additionalProperties": false
            },
            {
              "type": "object",
              "properties": {
                "status": {
                  "enum": [
                    "MISSING",
                    "PARTIAL",
                    "UNRESOLVED"
                  ]
                },
                "reason": {
                  "type": "string",
                  "minLength": 1
                }
              },
              "required": [
                "status",
                "reason"
              ],
              "additionalProperties": false
            }
          ]
        },
        "execution_log": {
          "anyOf": [
            {
              "type": "object",
              "properties": {
                "status": {
                  "const": "PRESENT"
                },
                "path": {
                  "type": "string",
                  "minLength": 1
                },
                "sha256": {
                  "type": "string",
                  "pattern": "^[0-9a-f]{64}$"
                }
              },
              "required": [
                "status",
                "path",
                "sha256"
              ],
              "additionalProperties": false
            },
            {
              "type": "object",
              "properties": {
                "status": {
                  "enum": [
                    "MISSING",
                    "PARTIAL",
                    "UNRESOLVED"
                  ]
                },
                "reason": {
                  "type": "string",
                  "minLength": 1
                }
              },
              "required": [
                "status",
                "reason"
              ],
              "additionalProperties": false
            }
          ]
        },
        "final_output": {
          "anyOf": [
            {
              "type": "object",
              "properties": {
                "status": {
                  "const": "PRESENT"
                },
                "path": {
                  "type": "string",
                  "minLength": 1
                },
                "sha256": {
                  "type": "string",
                  "pattern": "^[0-9a-f]{64}$"
                }
              },
              "required": [
                "status",
                "path",
                "sha256"
              ],
              "additionalProperties": false
            },
            {
              "type": "object",
              "properties": {
                "status": {
                  "enum": [
                    "MISSING",
                    "PARTIAL",
                    "UNRESOLVED"
                  ]
                },
                "reason": {
                  "type": "string",
                  "minLength": 1
                }
              },
              "required": [
                "status",
                "reason"
              ],
              "additionalProperties": false
            }
          ]
        },
        "reviewer": {
          "anyOf": [
            {
              "type": "object",
              "properties": {
                "status": {
                  "const": "PRESENT"
                },
                "path": {
                  "type": "string",
                  "minLength": 1
                },
                "sha256": {
                  "type": "string",
                  "pattern": "^[0-9a-f]{64}$"
                }
              },
              "required": [
                "status",
                "path",
                "sha256"
              ],
              "additionalProperties": false
            },
            {
              "type": "object",
              "properties": {
                "status": {
                  "enum": [
                    "MISSING",
                    "PARTIAL",
                    "UNRESOLVED"
                  ]
                },
                "reason": {
                  "type": "string",
                  "minLength": 1
                }
              },
              "required": [
                "status",
                "reason"
              ],
              "additionalProperties": false
            }
          ]
        },
        "current_snapshot_relation": {
          "anyOf": [
            {
              "type": "object",
              "properties": {
                "status": {
                  "const": "PRESENT"
                },
                "path": {
                  "type": "string",
                  "minLength": 1
                },
                "sha256": {
                  "type": "string",
                  "pattern": "^[0-9a-f]{64}$"
                }
              },
              "required": [
                "status",
                "path",
                "sha256"
              ],
              "additionalProperties": false
            },
            {
              "type": "object",
              "properties": {
                "status": {
                  "enum": [
                    "MISSING",
                    "PARTIAL",
                    "UNRESOLVED"
                  ]
                },
                "reason": {
                  "type": "string",
                  "minLength": 1
                }
              },
              "required": [
                "status",
                "reason"
              ],
              "additionalProperties": false
            }
          ]
        }
      },
      "required": [
        "fixture_identity",
        "expected_oracle",
        "human_authority",
        "pre_execution_receipt",
        "repository_snapshot",
        "executor_model",
        "runtime_configuration",
        "execution_log",
        "final_output",
        "reviewer",
        "current_snapshot_relation"
      ],
      "additionalProperties": false
    },
    "ordered_inputs": {
      "type": "array",
      "items": {
        "anyOf": [
          {
            "type": "object",
            "properties": {
              "status": {
                "const": "PRESENT"
              },
              "path": {
                "type": "string",
                "minLength": 1
              },
              "sha256": {
                "type": "string",
                "pattern": "^[0-9a-f]{64}$"
              }
            },
            "required": [
              "status",
              "path",
              "sha256"
            ],
            "additionalProperties": false
          },
          {
            "type": "object",
            "properties": {
              "status": {
                "enum": [
                  "MISSING",
                  "PARTIAL",
                  "UNRESOLVED"
                ]
              },
              "reason": {
                "type": "string",
                "minLength": 1
              }
            },
            "required": [
              "status",
              "reason"
            ],
            "additionalProperties": false
          }
        ]
      }
    },
    "limitations": {
      "type": "array",
      "items": {
        "type": "string",
        "minLength": 1
      }
    }
  },
  "required": [
    "receipt_version",
    "evaluation_id",
    "test_id",
    "phase",
    "recorded_at",
    "expected_timing",
    "functional_result",
    "evidence",
    "ordered_inputs",
    "limitations"
  ],
  "additionalProperties": false
}
